{
  "schemaVersion": 1,
  "gate": "D",
  "recordedAt": "2026-07-25T15:50:39.625Z",
  "environment": {
    "network": "ethereum-sepolia",
    "chainId": 11155111,
    "runtime": "official-nox-testnet"
  },
  "publicIdentifiers": {
    "deployer": "0xE412d04DA2A211F7ADC80311CC0FF9F03440B64E",
    "winner": "0x4d2809486012076B2212C829742BD95eF5992dB0",
    "contracts": {
      "Underlying": "0xb037445d0d51f28502f23aa0ad776952371fa858",
      "Wrapper": "0x2b3ec492631675eade166224aacd2c1a72350b4f",
      "SingleWinner": "0xd796931317188381a41d66ff7506c479888912ef",
      "SingleRefund": "0xe4ccf7956858023417768cfa0cc39e3cbf4f8673",
      "SplitWinnerEscrow": "0x13a0b71dc2013237c68434557e1872c6954faeb0",
      "SplitWinnerMarket": "0x4beb95390c29f49cf0d9011a8b5c01f57d4301f9",
      "SplitRefundEscrow": "0x569c3220c87403d055eaa4539f229a20e892d38f",
      "SplitRefundMarket": "0x049b6e37b14af41bd46de6e619cd2f0337f0d03a",
      "Underfunded": "0xa3ae9d12488611e2b193eff903af902ec2a3f938"
    },
    "transactions": {
      "deployUnderlying": "0xa354ccdd560493fb186ddefcbff0fe86f76e04c9b8905fb66d9c7e4243e01dc0",
      "deployWrapper": "0x185c11906c553fbe4f7f73e4ed63b088e80e60727ddf721b005cb82e236bf5bd",
      "mintUnderlying": "0x06778ecc53cda806742ad593d81ed8b07dc2af7568e319893563a9c2b3288bce",
      "approveWrapper": "0xf7c2200a6e586297d733bdd3ab0e5ec434bec34a236de745c97edc8bb253afe9",
      "wrapConfidential": "0x3e8ccb3f2cfa3db97da604ad0c36331f0be4c1d1c959fb879f329557a6dc2a48",
      "deploySingleWinner": "0xdb56b2f34ce0aaffec53bb6649e418f4de0eec86da1d77564923262ff97dbf2c",
      "singleWinnerOperator": "0xb691a37554355c6dd0e32deaaf1e5e42962bf563e9c48c4024867cba6dd1687f",
      "singleWinnerFund": "0x574b0f85faf97a0c6c96e2260f39f9d5c250548abeca088e163833d6d2ce7e2d",
      "singleWinnerConfirmFunding": "0x4fae05d894bfbdd8329b7a18ec7103c4ad14f64a1dc806f9282aae79e88c0572",
      "singleWinnerSetPrice": "0x7f08b2072757dfcbda226c5510e9344bb9d73940b366b7d3a6f8ca5a1dcbbeec",
      "singleWinnerSettle": "0xe196ff5c0d163422e88a28a82a3d940ecde85e7700dc696d2c872651a8d08596",
      "deploySingleRefund": "0x15cb0cd9c6e5d328f3725c32c0e58899af7d2512cfdb84b239c4e1879c31061d",
      "singleRefundOperator": "0x3bcc422a261eb5575b0c901cd750cd630be51c57dcf4e9615081834179a9cfa9",
      "singleRefundFund": "0x5d00f9741c1d43cfea7eb8498270975c2812a89b9e6977a1d1df8b3bae351a41",
      "singleRefundConfirmFunding": "0xfe6450fd764b5c81f7096e4bc09a5b6a12fc74ad531c977a44ab28406d75a73b",
      "singleRefundSettle": "0xb52d213fe4fbda10e5871d0f764cc71362a12846e0c40f9f4274f2989e5578ac",
      "deploySplitWinnerEscrow": "0xa6f97eec3c625e0bcee8f77173cd897f62ec4be9ed8699ac951c9311ac9f9b48",
      "deploySplitWinnerMarket": "0xff2c2c620014e7fc43ef22b47c91d5a34ed6b6fc997dc1c2d98b2e279bac756d",
      "splitWinnerConfigure": "0x30245498a6d8f462a60607becbbd5a6db52bdbafce6ba756864994d34dbe8c41",
      "splitWinnerOperator": "0xb2aa34a5f0f19d4a6b42c67389143bf67ac671588c4c6587a88929e076a02cf8",
      "splitWinnerFund": "0x8c0325f989a04733d27c9ae6dd22bc6ac6d64df78831f9881511dcd251c6a970",
      "splitWinnerConfirmFunding": "0x8dbcccaf0beed45678b67b2e6eed29be70688c45dabdf1cab98c64f21a256771",
      "splitWinnerSetPrice": "0x1d569b24ef3a1c4e44facdf90e976d601ecedf44dc5aa295a9255d2399d45867",
      "splitWinnerSettle": "0x7b17b9b6a33325f5781d3d33f734f852cf7a649da45119f49ed2735046f51b65",
      "deploySplitRefundEscrow": "0xd79ba8adbfc93bb9b5b85833388848391c0da9755769e5746146297f077b088d",
      "deploySplitRefundMarket": "0x2b2ce26d1debc80e499c2c8793485aeffeaaf2ee4bc055f28d936bcb54ff9589",
      "splitRefundConfigure": "0x8f7657bb3c03b8689b6dd3bcac7147bb1cba56391d6c83a20dc5a0ca1d9d9cb5",
      "splitRefundOperator": "0x2aaa9183d378c1406f70c214d6e28c68030afc493d38e9a4d3da1576452c019e",
      "splitRefundFund": "0xae83a7a6382d3f7f33627b39dd6ed733599659896e59c25f075b6d86d9b05f35",
      "splitRefundConfirmFunding": "0x1a727321baad05966da8b785a37843c7862fbc4eeb5bbe26e55cdfb74100936f",
      "splitRefundSettle": "0xf62a253389e9a9cca2b2f2433975273a4a3e2327704d22af2ce22f4ec62c7209",
      "deployUnderfunded": "0x2462c60f9b8ff9409ab4d1c116b20fbdebdf85913a584a77e85477c9ba025ac9",
      "underfundedOperator": "0x2a5ec0ad9a5c15c74463f7b19501b96d011ccfe61c4133e1b67af50d3d028e2d",
      "underfundedFund": "0x62f57a075cfb9d9243d090caf77d3c5933542a64e9a22b5eddcd07a3706c51cc"
    },
    "blocks": {
      "deployUnderlying": "11348645",
      "deployWrapper": "11348647",
      "mintUnderlying": "11348648",
      "approveWrapper": "11348649",
      "wrapConfidential": "11348650",
      "deploySingleWinner": "11348652",
      "singleWinnerOperator": "11348653",
      "singleWinnerFund": "11348654",
      "singleWinnerConfirmFunding": "11348656",
      "singleWinnerSetPrice": "11348657",
      "singleWinnerSettle": "11348658",
      "deploySingleRefund": "11348660",
      "singleRefundOperator": "11348661",
      "singleRefundFund": "11348662",
      "singleRefundConfirmFunding": "11348663",
      "singleRefundSettle": "11348664",
      "deploySplitWinnerEscrow": "11348666",
      "deploySplitWinnerMarket": "11348667",
      "splitWinnerConfigure": "11348669",
      "splitWinnerOperator": "11348670",
      "splitWinnerFund": "11348671",
      "splitWinnerConfirmFunding": "11348673",
      "splitWinnerSetPrice": "11348674",
      "splitWinnerSettle": "11348675",
      "deploySplitRefundEscrow": "11348676",
      "deploySplitRefundMarket": "11348678",
      "splitRefundConfigure": "11348679",
      "splitRefundOperator": "11348680",
      "splitRefundFund": "11348681",
      "splitRefundConfirmFunding": "11348684",
      "splitRefundSettle": "11348685",
      "deployUnderfunded": "11348686",
      "underfundedOperator": "11348687",
      "underfundedFund": "11348689"
    }
  },
  "assertions": {
    "officialWrapperDeployed": true,
    "wrappedBalanceVerifiedInMemory": true,
    "exactFundingProofVerified": true,
    "underfundedAttemptRejected": true,
    "singleWinnerRemainderVerifiedInMemory": true,
    "singleFullRefundVerifiedInMemory": true,
    "splitTransientAclVerified": true,
    "splitWinnerRemainderVerifiedInMemory": true,
    "splitFullRefundVerifiedInMemory": true,
    "doubleSettlementRejected": true,
    "confidentialConservationVerifiedInMemory": true
  },
  "blockers": [],
  "notes": [
    "Confidential balances, payment/refund values, handles, proofs, signatures, and wallet secrets were kept in memory and omitted from this artifact.",
    "The official ERC-7984 wrapper is exercised through a VeilBid-owned test subclass; no external deployment address was reused."
  ]
}
